{
  "databaseId": "00000000000000000000000000000001",
  "dialect": "voxel",
  "entries": [
    {
      "checksum": "98c9b8e457e3fad63e491007db8cfc29505b50b2bfb3b368a106e91bd40adb80",
      "directory": "0000_initial_00000000000000000000000000000013",
      "id": "00000000000000000000000000000013"
    },
    {
      "checksum": "e0f1f1d98aab38ccbfae68486f431f7820f777ad6665ab79dcbd7b3e5779f9ab",
      "directory": "0001_rebuild_parents_00000000000000000000000000000014",
      "id": "00000000000000000000000000000014"
    }
  ],
  "formatVersion": 1
}
